{
  "schema_version": "WHITE_RABBIT_EXECUTION_AUTHORIZATION_V0.1",
  "assay_id": "MINIMUM_IDENTITY_INDEPENDENCE_ASSAY_V0.1.4",
  "status": "IMPLEMENTATION_REVIEW_PASS / SEPARATE_ASSAY_AUTHORIZATION_REQUIRED",
  "authorized": false,
  "target_constitution": "assays/MINIMUM_IDENTITY_INDEPENDENCE_ASSAY_V0_1_4.md",
  "target_implementation": "tools/minimum_identity_independence_v014_v022.py",
  "review_artifact": "assays/MINIMUM_IDENTITY_INDEPENDENCE_IMPLEMENTATION_V0_1_12_RUNTIME_REVIEW.md",
  "scope": [
    "36 architecture-case evaluations",
    "2 clean controls + 4 critical mismatches + 3 diagnostics",
    "4 architectures"
  ],
  "authority_checkpoint": "WR_AUTHORITY_2026_08_26_V1",
  "reason": "Implementation review passed. Scientific assay execution has not been separately authorized."
}
